### ISSUE TITLE
Scanning with eSCL client to custom server fails for unknown reason.

### ISSUE THREAD

**Issue by markosjal** [alexpevzner/sane-airscan#175]
I have built an eSCL sharing server on Windows. Currently I have it 100% working with the Mopria Android client, and the AirScanner iOS Client. Yet unable to test with any MacOS

However, something very strange happens with this eSCL client and Document Scanner (simple scan?) 3.36.3 After the ScanJob XML Post is made it seems 30 seconds later this client (eSCL/Document Scanner)  sends a TCP packet to my port 8000 which is the port I am using for eSCL on my scan server.  Wireshark shows this as a TCP; FIN,ACK packet  .  I do not know what this packet is but seems to be the key moment of the failure. It may be a "keep Alive" packet?? At this moment the server is running a scan initiated via the web interface which may be too busy or too slow for a proper prompt reply. I have read extensively the Mopria docs and there seems to be no mention of something like this.

Looking at this packet in wireshark and clicking on "Follow TCP Stream" yields a screen with the POSTed XML 

here is the packet

`       Frame 1934: 60 bytes on wire (480 bits), 60 bytes captured (480 bits) on interface \Device\NPF_{F9153FB7-D3A1-4619-9289-0C89E54ADE94}, id 0
Ethernet II, Src: AzureWav_0d:e8:73 (40:e2:30:0d:e8:73), Dst: AMPAKTec_7d:7d:9a (cc:4b:73:7d:7d:9a)
Internet Protocol Version 4, Src: 192.168.0.107, Dst: 192.168.0.40
Transmission Control Protocol, Src Port: 46544, Dst Port: 8000, Seq: 864, Ack: 1, Len: 0
    Source Port: 46544
    Destination Port: 8000
    [Stream index: 3]
    [TCP Segment Len: 0]
    Sequence Number: 864    (relative sequence number)
    Sequence Number (raw): 3545655839
    [Next Sequence Number: 865    (relative sequence number)]
    Acknowledgment Number: 1    (relative ack number)
    Acknowledgment number (raw): 134225156
    0101 .... = Header Length: 20 bytes (5)
    Flags: 0x011 (FIN, ACK)
    Window: 502
    [Calculated window size: 64256]
    [Window size scaling factor: 128]
    Checksum: 0xf46e [unverified]
    [Checksum Status: Unverified]
    Urgent Pointer: 0
    [Timestamps]
        [Time since first frame in this TCP stream: 30.003605000 seconds]
        [Time since previous frame in this TCP stream: 29.949249000 seconds]
`

Apparently the server has some idea what to do with this and responds

`Frame 1935: 54 bytes on wire (432 bits), 54 bytes captured (432 bits) on interface \Device\NPF_{F9153FB7-D3A1-4619-9289-0C89E54ADE94}, id 0
Ethernet II, Src: AMPAKTec_7d:7d:9a (cc:4b:73:7d:7d:9a), Dst: AzureWav_0d:e8:73 (40:e2:30:0d:e8:73)
Internet Protocol Version 4, Src: 192.168.0.40, Dst: 192.168.0.107
Transmission Control Protocol, Src Port: 8000, Dst Port: 46544, Seq: 1, Ack: 865, Len: 0
    Source Port: 8000
    Destination Port: 46544
    [Stream index: 3]
    [TCP Segment Len: 0]
    Sequence Number: 1    (relative sequence number)
    Sequence Number (raw): 134225156
    [Next Sequence Number: 1    (relative sequence number)]
    Acknowledgment Number: 865    (relative ack number)
    Acknowledgment number (raw): 3545655840
    0101 .... = Header Length: 20 bytes (5)
    Flags: 0x010 (ACK)
    Window: 509
    [Calculated window size: 130304]
    [Window size scaling factor: 256]
    Checksum: 0xf467 [unverified]
    [Checksum Status: Unverified]
    Urgent Pointer: 0
    [SEQ/ACK analysis]
        [This is an ACK to the segment in frame: 1934]
        [The RTT to ACK the segment was: 0.000408000 seconds]
        [iRTT: 0.008992000 seconds]
    [Timestamps]
        [Time since first frame in this TCP stream: 30.004013000 seconds]
        [Time since previous frame in this TCP stream: 0.000408000 seconds]`

But that is not enough (or fast enough) to keep the Scan client happy.

**Comment by markosjal** [comment]
If anyone is interested in following this , now tested with OSX Mojave Imaging app to find similar results. It seems this may have to do with Keep-alives so since my server code is running on XAMPP on Windows I posted it here  https://community.apachefriends.org/f/viewtopic.php?f=16&t=81270&p=274294#p274294 . Oddly enough the Mopria Scan App does not have this issue!

https://community.apachefriends.org/f/viewtopic.php?f=16&t=81270&p=274294#p274294

**Comment by markosjal** [comment]
Okay, I have more info on this that seems relevant.......

I acquired an HP Color Laserjet M283fdw. After some testing I note the following

JPGs are transferred Immediately after each page is scanned on a sheetfeeder.  The SimpleScan (whatever it is now called) Client itself , does any and all processing if a PDF is the desired format. This is not the PDF defined in the Mopria Spec. The Mopria Spec would have it generated on the scanner.

So,
The eSCL format clearly stipulates that a REQUIRED format is PDF. In the case of a Multi-page PDF the PDF can not be generated until ALL pages have been scanned. This could mean that the client (SimpleScan with Airscan) needs to wait until ALL pages are scanned and the PDF is generated.SimpleScann with AirScan instead times out after about 2 minutes.

Have a look at the behavior of Mopria Scan on Android. It expects the PDF to be generated in the scanner and does not have a problem waiting up to about 300 seconds for that to happen under my current testing scenario. Simplescan with Airscan however seems to want to scan each page one by one , thus violating the conformity of eSCL by not allowing multi page PDFs to be generated on the host scanner.

Now in my case,  a Windows eSCL Scan server,  no JPG or PDF is generated until all pages are scanned. This works perfectly well on Mopria Android App with most any sheetfeeder scanner (except a few). 

A Multi-page tiff might be another reason that Airscan would need to "Hold on". The TIFF can not be generated until all pages are scanned.

This would be a non issue if PDFs were not part of the Mopria Spec but they are. An eSCL compatible client may need to "Hold on" till all pages are scanned and the file is generated.

Airscan times out after about 2 minutes, no matter how I try to manipulate server config or headers. I do not believe this is correct behavior for the eSCL protocol and comparing it to the most "official" eSCL client I have, Mopria Scan for Android, is incorrect behavior.

**Comment by alexpevzner** [comment]
Hi @markosjal,

SANE requires its drivers to return unpacked images. So adding PDF support will require `sane-airscan` to be able to unpack this format.

Existing PDF rendering libraries are heavyweigh and hard to use. Also, PDF doesn't guarantee lossless image. Actually, PDF may contain either lossless image in some PDF-specific format or just to be a container for JPEG-compressed image.

So for now I don't want to add PDF support to `sane-airscan`.

When single-image format, like JPEG, is used for ADF scan, `sane-airscan` generates a series of  `NextDocument` requests, and each request returns a single image. Even if internally the server scans a whole series of pages at once, it must return one image per request at this case.
